1,"air conditioner","n.","空調,冷氣機","a machine that keeps the air in a building cool","we want to buy a window air conditioner."
2,"system","n.","系統","","Our railway system is not very convenient."
3,"system","n.","制度","","Our education system needs to change."
4,"bravery","n.","勇敢","","The segeant was promoted for his bravery."
5,"program","n.","節目","","What's your favorite TV program?"
6,"program","n.","程式","","Mr. Lin wrote a program for his school that would help schedule classes."
7,"program","vt.","進行程序設定","","An industrial robot is programmed to do the same task repeatedly."
